{
  "blockers": [],
  "components": {
    "accessibility": 0.0,
    "api": 0.0,
    "flake_risk": 0.0,
    "functional": 0.0,
    "llm_audit": 0.0,
    "performance": 0.0,
    "security": 0.0,
    "visual": 0.0
  },
  "policy": {
    "block_on_critical": true,
    "block_on_high_security": true,
    "max_failed_p1_flows": 0,
    "max_flake_rate": 0.05,
    "min_quality_score": 80.0
  },
  "release_decision": "inconclusive",
  "run_id": "RUN-DRYRUNAAAAAA",
  "schema_version": "1",
  "severity_penalties": {
    "critical": 0.0,
    "high": 0.0,
    "info": 0.0,
    "low": 0.0,
    "medium": 0.0
  },
  "total": null,
  "weights": {
    "accessibility": 0.0,
    "api": 0.0,
    "flake_risk": 0.0,
    "functional": 0.0,
    "llm_audit": 0.0,
    "performance": 0.0,
    "security": 0.0,
    "visual": 0.0
  }
}
